{
  "schema_version": 1,
  "study_id": "replace-me",
  "title": "Replace me",
  "cycle": 1,
  "phase": "estimand",
  "gate": "awaiting_human",
  "toolchain": {
    "profile": "jaxstanv5-bayesite-v1",
    "model_authoring": "jaxstanv5",
    "engine": "bayesite",
    "visualization": "bayesite-viz"
  },
  "approved": {
    "scientific_question": null,
    "estimand": null,
    "generative_model": null,
    "estimator_plan": null,
    "simulation_tests": null,
    "real_fit": null,
    "model_criticism": null,
    "report": null
  },
  "thresholds": {
    "rhat_max": 1.01,
    "ess_bulk_min": 400,
    "ess_tail_min": 400,
    "divergences_max": 0
  },
  "open_questions": [],
  "decisions": [],
  "artifacts": [],
  "runs": [],
  "invalidated": [],
  "notes": []
}
